Column1;Column2;Column3;Column4;Column5;Exploit
CVE;CVSS Vector;Severity;Fonte;Descrizione;
CVE-2021-21261;CVSS:3.1/AV:L/AC:L/PR:L/UI:N/S:C/C:H/I:H/A:H;8.8 HIGH;NVD (crawl);Flatpak is a system for building, distributing, and running sandboxed desktop applications on Linux. A bug was discovered in the `flatpak-portal` service that can allow sandboxed applications to execute arbitrary code on the host system (a sandbox escape). This sandbox-escape bug is present in versions from 0.11.4 and before fixed versions 1.8.5 and 1.10.0. The Flatpak portal D-Bus service (`flatpak-portal`, also known by its D-Bus service name `org.freedesktop.portal.Flatpak`) allows apps in a Flatpak sandbox to launch their own subprocesses in a new sandbox instance, either with the same security settings as the caller or with more restrictive security settings. For example, this is used in Flatpak-packaged web browsers such as Chromium to launch subprocesses that will process untrusted web content, and give those subprocesses a more restrictive sandbox than the browser itself. In vulnerable versions, the Flatpak portal service passes caller-specified environment variables to non-sandboxed processes on the host system, and in particular to the `flatpak run` command that is used to launch the new sandbox instance. A malicious or compromised Flatpak app could set environment variables that are trusted by the `flatpak run` command, and use them to execute arbitrary code that is not in a sandbox. As a workaround, this vulnerability can be mitigated by preventing the `flatpak-portal` service from starting, but that mitigation will prevent many Flatpak apps from working correctly. This is fixed in versions 1.8.5 and 1.10.0.;NO
CVE-2021-0071;CVSS:3.1/AV:A/AC:L/PR:N/UI:N/S:U/C:H/I:H/A:H;8.8 HIGH;NVD (crawl);Improper input validation in firmware for some Intel(R) PROSet/Wireless WiFi in UEFI may allow an unauthenticated user to potentially enable escalation of privilege via adjacent access.;NO
CVE-2022-33745;CVSS:3.1/AV:L/AC:L/PR:L/UI:N/S:C/C:H/I:H/A:H;8.8 HIGH;NVD (crawl);insufficient TLB flush for x86 PV guests in shadow mode For migration as well as to work around kernels unaware of L1TF (see XSA-273), PV guests may be run in shadow paging mode. To address XSA-401, code was moved inside a function in Xen. This code movement missed a variable changing meaning / value between old and new code positions. The now wrong use of the variable did lead to a wrong TLB flush condition, omitting flushes where such are necessary.;NO
CVE-2019-8922;CVSS:3.1/AV:A/AC:L/PR:N/UI:N/S:U/C:H/I:H/A:H;8.8 HIGH;NVD (crawl);A heap-based buffer overflow was discovered in bluetoothd in BlueZ through 5.48. There isn't any check on whether there is enough space in the destination buffer. The function simply appends all data passed to it. The values of all attributes that are requested are appended to the output buffer. There are no size checks whatsoever, resulting in a simple heap overflow if one can craft a request where the response is large enough to overflow the preallocated buffer. This issue exists in service_attr_req gets called by process_request (in sdpd-request.c), which also allocates the response buffer.;NO
CVE-2022-0204;CVSS:3.1/AV:A/AC:L/PR:N/UI:N/S:U/C:H/I:H/A:H;8.8 HIGH;NVD (crawl);A heap overflow vulnerability was found in bluez in versions prior to 5.63. An attacker with local network access could pass specially crafted files causing an application to halt or crash, leading to a denial of service.;NO
CVE-2021-43860;CVSS:3.1/AV:L/AC:L/PR:N/UI:R/S:C/C:H/I:H/A:H;8.6 HIGH;NVD (crawl);"Flatpak is a Linux application sandboxing and distribution framework. Prior to versions 1.12.3 and 1.10.6, Flatpak doesn't properly validate that the permissions displayed to the user for an app at install time match the actual permissions granted to the app at runtime, in the case that there's a null byte in the metadata file of an app. Therefore apps can grant themselves permissions without the consent of the user. Flatpak shows permissions to the user during install by reading them from the ""xa.metadata"" key in the commit metadata. This cannot contain a null terminator, because it is an untrusted GVariant. Flatpak compares these permissions to the *actual* metadata, from the ""metadata"" file to ensure it wasn't lied to. However, the actual metadata contents are loaded in several places where they are read as simple C-style strings. That means that, if the metadata file includes a null terminator, only the content of the file from *before* the terminator gets compared to xa.metadata. Thus, any permissions that appear in the metadata file after a null terminator are applied at runtime but not shown to the user. So maliciously crafted apps can give themselves hidden permissions. Users who have Flatpaks installed from untrusted sources are at risk in case the Flatpak has a maliciously crafted metadata file, either initially or in an update. This issue is patched in versions 1.12.3 and 1.10.6. As a workaround, users can manually check the permissions of installed apps by checking the metadata file or the xa.metadata key on the commit metadata.";NO
CVE-2022-0185;CVSS:3.1/AV:L/AC:L/PR:N/UI:N/S:U/C:H/I:H/A:H;8.4 HIGH;NVD (crawl);A heap-based buffer overflow flaw was found in the way the legacy_parse_param function in the Filesystem Context functionality of the Linux kernel verified the supplied parameters length. An unprivileged (in case of unprivileged user namespaces enabled, otherwise needs namespaced CAP_SYS_ADMIN privilege) local user able to open a filesystem that does not support the Filesystem Context API (and thus fallbacks to legacy handling) could use this flaw to escalate their privileges on the system.;NO
CVE-2021-0066;CVSS:3.1/AV:L/AC:L/PR:N/UI:N/S:U/C:H/I:H/A:H;8.4 HIGH;NVD (crawl);Improper input validation in firmware for Intel(R) PROSet/Wireless Wi-Fi in multiple operating systems and Killer(TM) Wi-Fi in Windows 10 and 11 may allow an unauthenticated user to potentially enable escalation of privilege via local access.;NO
CVE-2021-4157;CVSS:3.1/AV:A/AC:L/PR:L/UI:N/S:U/C:H/I:H/A:H;8.0 HIGH;NVD (crawl);An out of memory bounds write flaw (1 or 2 bytes of memory) in the Linux kernel NFS subsystem was found in the way users use mirroring (replication of files with NFS). A user, having access to the NFS mount, could potentially use this flaw to crash the system or escalate privileges on the system.;NO
CVE-2021-4157;CVSS:3.1/AV:A/AC:L/PR:L/UI:N/S:U/C:H/I:H/A:H;8.0 HIGH;NVD (crawl);An out of memory bounds write flaw (1 or 2 bytes of memory) in the Linux kernel NFS subsystem was found in the way users use mirroring (replication of files with NFS). A user, having access to the NFS mount, could potentially use this flaw to crash the system or escalate privileges on the system.;NO
CVE-2021-4009;CVSS:3.1/AV:L/AC:L/PR:L/UI:N/S:U/C:H/I:H/A:H;7.8 HIGH;NVD (crawl);A flaw was found in xorg-x11-server in versions before 21.1.2 and before 1.20.14. An out-of-bounds access can occur in the SProcXFixesCreatePointerBarrier function. The highest threat from this vulnerability is to data confidentiality and integrity as well as system availability.;NO
CVE-2021-4010;CVSS:3.1/AV:L/AC:L/PR:L/UI:N/S:U/C:H/I:H/A:H;7.8 HIGH;NVD (crawl);A flaw was found in xorg-x11-server in versions before 21.1.2 and before 1.20.14. An out-of-bounds access can occur in the SProcScreenSaverSuspend function. The highest threat from this vulnerability is to data confidentiality and integrity as well as system availability.;NO
CVE-2021-4011;CVSS:3.1/AV:L/AC:L/PR:L/UI:N/S:U/C:H/I:H/A:H;7.8 HIGH;NVD (crawl);A flaw was found in xorg-x11-server in versions before 21.1.2 and before 1.20.14. An out-of-bounds access can occur in the SwapCreateRegister function. The highest threat from this vulnerability is to data confidentiality and integrity as well as system availability.;NO
CVE-2021-4034;CVSS:3.1/AV:L/AC:L/PR:L/UI:N/S:U/C:H/I:H/A:H;7.8 HIGH;NVD (crawl);A local privilege escalation vulnerability was found on polkit's pkexec utility. The pkexec application is a setuid tool designed to allow unprivileged users to run commands as privileged users according predefined policies. The current version of pkexec doesn't handle the calling parameters count correctly and ends trying to execute environment variables as commands. An attacker can leverage this by crafting environment variables in such a way it'll induce pkexec to execute arbitrary code. When successfully executed the attack can cause a local privilege escalation given unprivileged users administrative rights on the target machine.;SI
CVE-2021-46143;CVSS:3.1/AV:L/AC:L/PR:N/UI:R/S:U/C:H/I:H/A:H;7.8 HIGH;NVD (crawl);In doProlog in xmlparse.c in Expat (aka libexpat) before 2.4.3, an integer overflow exists for m_groupSize.;NO
CVE-2020-12762;CVSS:3.1/AV:L/AC:L/PR:N/UI:R/S:U/C:H/I:H/A:H;7.8 HIGH;NVD (crawl);json-c through 0.14 has an integer overflow and out-of-bounds write via a large JSON file, as demonstrated by printbuf_memappend.;NO
CVE-2020-27918;CVSS:3.1/AV:L/AC:L/PR:N/UI:R/S:U/C:H/I:H/A:H;7.8 HIGH;NVD (crawl);A use after free issue was addressed with improved memory management. This issue is fixed in macOS Big Sur 11.0.1, watchOS 7.1, iOS 14.2 and iPadOS 14.2, iCloud for Windows 11.5, Safari 14.0.1, tvOS 14.2, iTunes 12.11 for Windows. Processing maliciously crafted web content may lead to arbitrary code execution.;NO
CVE-2021-30846;CVSS:3.1/AV:L/AC:L/PR:N/UI:R/S:U/C:H/I:H/A:H;7.8 HIGH;NVD (crawl);A memory corruption issue was addressed with improved memory handling. This issue is fixed in iOS 14.8 and iPadOS 14.8, Safari 15, tvOS 15, iOS 15 and iPadOS 15, watchOS 8. Processing maliciously crafted web content may lead to arbitrary code execution.;NO
CVE-2021-30848;CVSS:3.1/AV:L/AC:L/PR:N/UI:R/S:U/C:H/I:H/A:H;7.8 HIGH;NVD (crawl);A memory corruption issue was addressed with improved memory handling. This issue is fixed in iOS 14.8 and iPadOS 14.8, Safari 15, iOS 15 and iPadOS 15. Processing maliciously crafted web content may lead to code execution.;NO
CVE-2021-30849;CVSS:3.1/AV:L/AC:L/PR:N/UI:R/S:U/C:H/I:H/A:H;7.8 HIGH;NVD (crawl);Multiple memory corruption issues were addressed with improved memory handling. This issue is fixed in iOS 14.8 and iPadOS 14.8, watchOS 8, Safari 15, tvOS 15, iOS 15 and iPadOS 15, iTunes 12.12 for Windows. Processing maliciously crafted web content may lead to arbitrary code execution.;NO
CVE-2021-4197;CVSS:3.1/AV:L/AC:L/PR:L/UI:N/S:U/C:H/I:H/A:H;7.8 HIGH;NVD (crawl);An unprivileged write to the file handler flaw in the Linux kernel's control groups and namespaces subsystem was found in the way users have access to some less privileged process that are controlled by cgroups and have higher privileged parent process. It is actually both for cgroup2 and cgroup1 versions of control groups. A local user could use this flaw to crash the system or escalate their privileges on the system.;NO
CVE-2022-0330;CVSS:3.1/AV:L/AC:L/PR:L/UI:N/S:U/C:H/I:H/A:H;7.8 HIGH;NVD (crawl);A random memory access flaw was found in the Linux kernel's GPU i915 kernel driver functionality in the way a user may run malicious code on the GPU. This flaw allows a local user to crash the system or escalate their privileges on the system.;NO
CVE-2022-22942;CVSS:3.1/AV:L/AC:L/PR:L/UI:N/S:U/C:H/I:H/A:H;7.8 HIGH;NVD (crawl);The vmwgfx driver contains a local privilege escalation vulnerability that allows unprivileged users to gain access to files opened by other processes on the system through a dangling 'file' pointer.;NO
CVE-2020-35523;CVSS:3.1/AV:L/AC:L/PR:N/UI:R/S:U/C:H/I:H/A:H;7.8 HIGH;NVD (crawl);An integer overflow flaw was found in libtiff that exists in the tif_getimage.c file. This flaw allows an attacker to inject and execute arbitrary code when a user opens a crafted TIFF file. The highest threat from this vulnerability is to confidentiality, integrity, as well as system availability.;NO
CVE-2020-35524;CVSS:3.1/AV:L/AC:L/PR:N/UI:R/S:U/C:H/I:H/A:H;7.8 HIGH;NVD (crawl);A heap-based buffer overflow flaw was found in libtiff in the handling of TIFF images in libtiff's TIFF2PDF tool. A specially crafted TIFF file can lead to arbitrary code execution. The highest threat from this vulnerability is to confidentiality, integrity, as well as system availability.;NO
CVE-2022-0135;CVSS:3.1/AV:L/AC:L/PR:L/UI:N/S:U/C:H/I:H/A:H;7.8 HIGH;NVD (crawl);An out-of-bounds write issue was found in the VirGL virtual OpenGL renderer (virglrenderer). This flaw allows a malicious guest to create a specially crafted virgil resource and then issue a VIRTGPU_EXECBUFFER ioctl, leading to a denial of service or possible code execution.;NO
CVE-2022-23033;CVSS:3.1/AV:L/AC:L/PR:L/UI:N/S:U/C:H/I:H/A:H;7.8 HIGH;NVD (crawl);arm: guest_physmap_remove_page not removing the p2m mappings The functions to remove one or more entries from a guest p2m pagetable on Arm (p2m_remove_mapping, guest_physmap_remove_page, and p2m_set_entry with mfn set to INVALID_MFN) do not actually clear the pagetable entry if the entry doesn't have the valid bit set. It is possible to have a valid pagetable entry without the valid bit set when a guest operating system uses set/way cache maintenance instructions. For instance, a guest issuing a set/way cache maintenance instruction, then calling the XENMEM_decrease_reservation hypercall to give back memory pages to Xen, might be able to retain access to those pages even after Xen started reusing them for other purposes.;NO
CVE-2021-3778;CVSS:3.1/AV:L/AC:L/PR:N/UI:R/S:U/C:H/I:H/A:H;7.8 HIGH;NVD (crawl);vim is vulnerable to Heap-based Buffer Overflow;NO
CVE-2021-3872;CVSS:3.1/AV:L/AC:L/PR:N/UI:R/S:U/C:H/I:H/A:H;7.8 HIGH;NVD (crawl);vim is vulnerable to Heap-based Buffer Overflow;NO
CVE-2021-3927;CVSS:3.1/AV:L/AC:L/PR:N/UI:R/S:U/C:H/I:H/A:H;7.8 HIGH;NVD (crawl);vim is vulnerable to Heap-based Buffer Overflow;NO
CVE-2021-3928;CVSS:3.1/AV:L/AC:L/PR:L/UI:N/S:U/C:H/I:H/A:H;7.8 HIGH;NVD (crawl);vim is vulnerable to Use of Uninitialized Variable;NO
CVE-2021-3984;CVSS:3.1/AV:L/AC:L/PR:N/UI:R/S:U/C:H/I:H/A:H;7.8 HIGH;NVD (crawl);vim is vulnerable to Heap-based Buffer Overflow;NO
CVE-2021-4019;CVSS:3.1/AV:L/AC:L/PR:N/UI:R/S:U/C:H/I:H/A:H;7.8 HIGH;NVD (crawl);vim is vulnerable to Heap-based Buffer Overflow;NO
CVE-2022-0351;CVSS:3.1/AV:L/AC:L/PR:L/UI:N/S:U/C:H/I:H/A:H;7.8 HIGH;NVD (crawl);Access of Memory Location Before Start of Buffer in GitHub repository vim/vim prior to 8.2.;NO
CVE-2022-0361;CVSS:3.1/AV:L/AC:L/PR:N/UI:R/S:U/C:H/I:H/A:H;7.8 HIGH;NVD (crawl);Heap-based Buffer Overflow in GitHub repository vim/vim prior to 8.2.;NO
CVE-2022-0413;CVSS:3.1/AV:L/AC:L/PR:N/UI:R/S:U/C:H/I:H/A:H;7.8 HIGH;NVD (crawl);Use After Free in GitHub repository vim/vim prior to 8.2.;NO
CVE-2021-30952;CVSS:3.1/AV:L/AC:L/PR:N/UI:R/S:U/C:H/I:H/A:H;7.8 HIGH;NVD (crawl);An integer overflow was addressed with improved input validation. This issue is fixed in tvOS 15.2, macOS Monterey 12.1, Safari 15.2, iOS 15.2 and iPadOS 15.2, watchOS 8.3. Processing maliciously crafted web content may lead to arbitrary code execution.;NO
CVE-2021-30954;CVSS:3.1/AV:L/AC:L/PR:N/UI:R/S:U/C:H/I:H/A:H;7.8 HIGH;NVD (crawl);A type confusion issue was addressed with improved memory handling. This issue is fixed in tvOS 15.2, macOS Monterey 12.1, Safari 15.2, iOS 15.2 and iPadOS 15.2, watchOS 8.3. Processing maliciously crafted web content may lead to arbitrary code execution.;NO
CVE-2021-0164;CVSS:3.1/AV:L/AC:L/PR:L/UI:N/S:U/C:H/I:H/A:H;7.8 HIGH;NVD (crawl);Improper access control in firmware for Intel(R) PROSet/Wireless Wi-Fi in multiple operating systems and Killer(TM) Wi-Fi in Windows 10 and 11 may allow an unauthenticated user to potentially enable escalation of privilege via local access.;NO
CVE-2022-0492;CVSS:3.1/AV:L/AC:L/PR:L/UI:N/S:U/C:H/I:H/A:H;7.8 HIGH;NVD (crawl);A vulnerability was found in the Linux kernel’s cgroup_release_agent_write in the kernel/cgroup/cgroup-v1.c function. This flaw, under certain circumstances, allows the use of the cgroups v1 release_agent feature to escalate privileges and bypass the namespace isolation unexpectedly.;NO
CVE-2022-0516;CVSS:3.1/AV:L/AC:L/PR:L/UI:N/S:U/C:H/I:H/A:H;7.8 HIGH;NVD (crawl);A vulnerability was found in kvm_s390_guest_sida_op in the arch/s390/kvm/kvm-s390.c function in KVM for s390 in the Linux kernel. This flaw allows a local attacker with a normal user privilege to obtain unauthorized memory write access. This flaw affects Linux kernel versions prior to 5.17-rc4.;NO
CVE-2022-0847;CVSS:3.1/AV:L/AC:L/PR:L/UI:N/S:U/C:H/I:H/A:H;7.8 HIGH;NVD (crawl);"A flaw was found in the way the ""flags"" member of the new pipe buffer structure was lacking proper initialization in copy_page_to_iter_pipe and push_pipe functions in the Linux kernel and could thus contain stale values. An unprivileged local user could use this flaw to write to pages in the page cache backed by read only files and as such escalate their privileges on the system.";NO
CVE-2022-24958;CVSS:3.1/AV:L/AC:L/PR:L/UI:N/S:U/C:H/I:H/A:H;7.8 HIGH;NVD (crawl);drivers/usb/gadget/legacy/inode.c in the Linux kernel through 5.16.8 mishandles dev->buf release.;NO
CVE-2021-3999;CVSS:3.1/AV:L/AC:L/PR:L/UI:N/S:U/C:H/I:H/A:H;7.8 HIGH;NVD (crawl);A flaw was found in glibc. An off-by-one buffer overflow and underflow in getcwd() may lead to memory corruption when the size of the buffer is exactly 1. A local attacker who can control the input buffer and size passed to getcwd() in a setuid program could use this flaw to potentially execute arbitrary code and escalate their privileges on the system.;NO
CVE-2022-23853;CVSS:3.1/AV:L/AC:L/PR:N/UI:R/S:U/C:H/I:H/A:H;7.8 HIGH;NVD (crawl);The LSP (Language Server Protocol) plugin in KDE Kate before 21.12.2 and KTextEditor before 5.91.0 tries to execute the associated LSP server binary when opening a file of a given type. If this binary is absent from the PATH, it will try running the LSP server binary in the directory of the file that was just opened (due to a misunderstanding of the QProcess API, that was never intended). This can be an untrusted directory.;NO
CVE-2022-25255;CVSS:3.1/AV:L/AC:L/PR:L/UI:N/S:U/C:H/I:H/A:H;7.8 HIGH;NVD (crawl);In Qt 5.9.x through 5.15.x before 5.15.9 and 6.x before 6.2.4 on Linux and UNIX, QProcess could execute a binary from the current working directory when not found in the PATH.;NO
CVE-2020-15862;CVSS:3.1/AV:L/AC:L/PR:L/UI:N/S:U/C:H/I:H/A:H;7.8 HIGH;NVD (crawl);Net-SNMP through 5.8 has Improper Privilege Management because SNMP WRITE access to the EXTEND MIB provides the ability to run arbitrary commands as root.;NO
CVE-2021-39698;CVSS:3.1/AV:L/AC:L/PR:L/UI:N/S:U/C:H/I:H/A:H;7.8 HIGH;NVD (crawl);In aio_poll_complete_work of aio.c, there is a possible memory corruption due to a use after free. This could lead to local escalation of privilege with no additional execution privileges needed. User interaction is not needed for exploitation.Product: AndroidVersions: Android kernelAndroid ID: A-185125206References: Upstream kernel;NO
CVE-2022-1055;CVSS:3.1/AV:L/AC:L/PR:L/UI:N/S:U/C:H/I:H/A:H;7.8 HIGH;NVD (crawl);A use-after-free exists in the Linux Kernel in tc_new_tfilter that could allow a local attacker to gain privilege escalation. The exploit requires unprivileged user namespaces. We recommend upgrading past commit 04c2a47ffb13c29778e2a14e414ad4cb5a5db4b5;NO
CVE-2022-26490;CVSS:3.1/AV:L/AC:L/PR:L/UI:N/S:U/C:H/I:H/A:H;7.8 HIGH;NVD (crawl);st21nfca_connectivity_event_received in drivers/nfc/st21nfca/se.c in the Linux kernel through 5.16.12 has EVT_TRANSACTION buffer overflows because of untrusted length parameters.;NO
CVE-2022-27666;CVSS:3.1/AV:L/AC:L/PR:L/UI:N/S:U/C:H/I:H/A:H;7.8 HIGH;NVD (crawl);A heap buffer overflow flaw was found in IPsec ESP transformation code in net/ipv4/esp4.c and net/ipv6/esp6.c. This flaw allows a local attacker with a normal user privilege to overwrite kernel heap objects and may cause a local privilege escalation threat.;NO
CVE-2022-28390;CVSS:3.1/AV:L/AC:L/PR:L/UI:N/S:U/C:H/I:H/A:H;7.8 HIGH;NVD (crawl);ems_usb_start_xmit in drivers/net/can/usb/ems_usb.c in the Linux kernel through 5.17.1 has a double free.;NO
CVE-2020-27823;CVSS:3.1/AV:L/AC:L/PR:N/UI:R/S:U/C:H/I:H/A:H;7.8 HIGH;NVD (crawl);A flaw was found in OpenJPEG’s encoder. This flaw allows an attacker to pass specially crafted x,y offset input to OpenJPEG to use during encoding. The highest threat from this vulnerability is to confidentiality, integrity, as well as system availability.;NO
CVE-2020-27823;CVSS:3.1/AV:L/AC:L/PR:N/UI:R/S:U/C:H/I:H/A:H;7.8 HIGH;NVD (crawl);A flaw was found in OpenJPEG’s encoder. This flaw allows an attacker to pass specially crafted x,y offset input to OpenJPEG to use during encoding. The highest threat from this vulnerability is to confidentiality, integrity, as well as system availability.;NO
CVE-2022-1215;CVSS:3.1/AV:L/AC:L/PR:L/UI:N/S:U/C:H/I:H/A:H;7.8 HIGH;NVD (crawl);A format string vulnerability was found in libinput;NO
CVE-2022-26358;CVSS:3.1/AV:L/AC:L/PR:L/UI:N/S:U/C:H/I:H/A:H;7.8 HIGH;NVD (crawl);"IOMMU: RMRR (VT-d) and unity map (AMD-Vi) handling issues T[his CNA information record relates to multiple CVEs; the text explains which aspects/vulnerabilities correspond to which CVE.] Certain PCI devices in a system might be assigned Reserved Memory Regions (specified via Reserved Memory Region Reporting, ""RMRR"") for Intel VT-d or Unity Mapping ranges for AMD-Vi. These are typically used for platform tasks such as legacy USB emulation. Since the precise purpose of these regions is unknown, once a device associated with such a region is active, the mappings of these regions need to remain continuouly accessible by the device. This requirement has been violated. Subsequent DMA or interrupts from the device may have unpredictable behaviour, ranging from IOMMU faults to memory corruption.";NO
CVE-2022-26359;CVSS:3.1/AV:L/AC:L/PR:L/UI:N/S:U/C:H/I:H/A:H;7.8 HIGH;NVD (crawl);"IOMMU: RMRR (VT-d) and unity map (AMD-Vi) handling issues T[his CNA information record relates to multiple CVEs; the text explains which aspects/vulnerabilities correspond to which CVE.] Certain PCI devices in a system might be assigned Reserved Memory Regions (specified via Reserved Memory Region Reporting, ""RMRR"") for Intel VT-d or Unity Mapping ranges for AMD-Vi. These are typically used for platform tasks such as legacy USB emulation. Since the precise purpose of these regions is unknown, once a device associated with such a region is active, the mappings of these regions need to remain continuouly accessible by the device. This requirement has been violated. Subsequent DMA or interrupts from the device may have unpredictable behaviour, ranging from IOMMU faults to memory corruption.";NO
CVE-2022-26360;CVSS:3.1/AV:L/AC:L/PR:L/UI:N/S:U/C:H/I:H/A:H;7.8 HIGH;NVD (crawl);"IOMMU: RMRR (VT-d) and unity map (AMD-Vi) handling issues T[his CNA information record relates to multiple CVEs; the text explains which aspects/vulnerabilities correspond to which CVE.] Certain PCI devices in a system might be assigned Reserved Memory Regions (specified via Reserved Memory Region Reporting, ""RMRR"") for Intel VT-d or Unity Mapping ranges for AMD-Vi. These are typically used for platform tasks such as legacy USB emulation. Since the precise purpose of these regions is unknown, once a device associated with such a region is active, the mappings of these regions need to remain continuouly accessible by the device. This requirement has been violated. Subsequent DMA or interrupts from the device may have unpredictable behaviour, ranging from IOMMU faults to memory corruption.";NO
CVE-2022-26361;CVSS:3.1/AV:L/AC:L/PR:L/UI:N/S:U/C:H/I:H/A:H;7.8 HIGH;NVD (crawl);"IOMMU: RMRR (VT-d) and unity map (AMD-Vi) handling issues T[his CNA information record relates to multiple CVEs; the text explains which aspects/vulnerabilities correspond to which CVE.] Certain PCI devices in a system might be assigned Reserved Memory Regions (specified via Reserved Memory Region Reporting, ""RMRR"") for Intel VT-d or Unity Mapping ranges for AMD-Vi. These are typically used for platform tasks such as legacy USB emulation. Since the precise purpose of these regions is unknown, once a device associated with such a region is active, the mappings of these regions need to remain continuouly accessible by the device. This requirement has been violated. Subsequent DMA or interrupts from the device may have unpredictable behaviour, ranging from IOMMU faults to memory corruption.";NO
CVE-2022-27239;CVSS:3.1/AV:L/AC:L/PR:L/UI:N/S:U/C:H/I:H/A:H;7.8 HIGH;NVD (crawl);In cifs-utils through 6.14, a stack-based buffer overflow when parsing the mount.cifs ip= command-line argument could lead to local attackers gaining root privileges.;NO
CVE-2022-1304;CVSS:3.1/AV:L/AC:L/PR:N/UI:R/S:U/C:H/I:H/A:H;7.8 HIGH;NVD (crawl);An out-of-bounds read/write vulnerability was found in e2fsprogs 1.46.5. This issue leads to a segmentation fault and possibly arbitrary code execution via a specially crafted filesystem.;NO
CVE-2022-28735;CVSS:3.1/AV:L/AC:L/PR:L/UI:N/S:U/C:H/I:H/A:H;7.8 HIGH;NVD (crawl);The GRUB2's shim_lock verifier allows non-kernel files to be loaded on shim-powered secure boot systems. Allowing such files to be loaded may lead to unverified code and modules to be loaded in GRUB2 breaking the secure boot trust-chain.;NO
CVE-2022-28736;CVSS:3.1/AV:L/AC:L/PR:L/UI:N/S:U/C:H/I:H/A:H;7.8 HIGH;NVD (crawl);"There's a use-after-free vulnerability in grub_cmd_chainloader() function; The chainloader command is used to boot up operating systems that doesn't support multiboot and do not have direct support from GRUB2. When executing chainloader more than once a use-after-free vulnerability is triggered. If an attacker can control the GRUB2's memory allocation pattern sensitive data may be exposed and arbitrary code execution can be achieved.";NO
