Column1;Column2;Column3;Column4;Column5;Exploit
CVE-2021-26348;CVSS:3.1/AV:L/AC:L/PR:L/UI:N/S:U/C:N/I:H/A:N;5.5 MEDIUM;NVD (crawl);Failure to flush the Translation Lookaside Buffer (TLB) of the I/O memory management unit (IOMMU) may lead an IO device to write to memory it should not be able to access, resulting in a potential loss of integrity.;NO
CVE-2021-26349;CVSS:3.1/AV:L/AC:L/PR:L/UI:N/S:U/C:N/I:H/A:N;5.5 MEDIUM;NVD (crawl);Failure to assign a new report ID to an imported guest may potentially result in an SEV-SNP guest VM being tricked into trusting a dishonest Migration Agent (MA).;NO
CVE-2021-26364;CVSS:3.1/AV:L/AC:L/PR:L/UI:N/S:U/C:N/I:N/A:H;5.5 MEDIUM;NVD (crawl);Insufficient bounds checking in an SMU mailbox register could allow an attacker to potentially read outside of the SRAM address range which could result in an exception handling leading to a potential denial of service.;NO
CVE-2021-26372;CVSS:3.1/AV:L/AC:L/PR:L/UI:N/S:U/C:N/I:N/A:H;5.5 MEDIUM;NVD (crawl);Insufficient bound checks related to PCIE in the System Management Unit (SMU) may result in access to an invalid address space that could result in denial of service.;NO
CVE-2021-26373;CVSS:3.1/AV:L/AC:L/PR:L/UI:N/S:U/C:N/I:N/A:H;5.5 MEDIUM;NVD (crawl);Insufficient bound checks in the System Management Unit (SMU) may result in a system voltage malfunction that could result in denial of resources and/or possibly denial of service.;NO
CVE-2021-26375;CVSS:3.1/AV:L/AC:L/PR:L/UI:N/S:U/C:N/I:N/A:H;5.5 MEDIUM;NVD (crawl);Insufficient General Purpose IO (GPIO) bounds check in System Management Unit (SMU) may result in access/updates from/to invalid address space that could result in denial of service.;NO
CVE-2021-26376;CVSS:3.1/AV:L/AC:L/PR:L/UI:N/S:U/C:N/I:N/A:H;5.5 MEDIUM;NVD (crawl);Insufficient checks in System Management Unit (SMU) FeatureConfig may result in reenabling features potentially resulting in denial of resources and/or denial of service.;NO
CVE-2021-26378;CVSS:3.1/AV:L/AC:L/PR:L/UI:N/S:U/C:N/I:N/A:H;5.5 MEDIUM;NVD (crawl);Insufficient bound checks in the System Management Unit (SMU) may result in access to an invalid address space that could result in denial of service.;NO
CVE-2021-26388;CVSS:3.1/AV:L/AC:L/PR:L/UI:N/S:U/C:N/I:N/A:H;5.5 MEDIUM;NVD (crawl);Improper validation of the BIOS directory may allow for searches to read beyond the directory table copy in RAM, exposing out of bounds memory contents, resulting in a potential denial of service.;NO
CVE-2022-0561;CVSS:3.1/AV:L/AC:L/PR:N/UI:R/S:U/C:N/I:N/A:H;5.5 MEDIUM;NVD (crawl);Null source pointer passed as an argument to memcpy() function within TIFFFetchStripThing() in tif_dirread.c in libtiff versions from 3.9.0 to 4.3.0 could lead to Denial of Service via crafted TIFF file. For users that compile libtiff from sources, the fix is available with commit eecb0712.;NO
CVE-2022-0562;CVSS:3.1/AV:L/AC:L/PR:N/UI:R/S:U/C:N/I:N/A:H;5.5 MEDIUM;NVD (crawl);Null source pointer passed as an argument to memcpy() function within TIFFReadDirectory() in tif_dirread.c in libtiff versions from 4.0 to 4.3.0 could lead to Denial of Service via crafted TIFF file. For users that compile libtiff from sources, a fix is available with commit 561599c.;NO
CVE-2022-0908;CVSS:3.1/AV:L/AC:L/PR:N/UI:R/S:U/C:N/I:N/A:H;5.5 MEDIUM;NVD (crawl);Null source pointer passed as an argument to memcpy() function within TIFFFetchNormalTag () in tif_dirread.c in libtiff versions up to 4.3.0 could lead to Denial of Service via crafted TIFF file.;NO
CVE-2022-0909;CVSS:3.1/AV:L/AC:L/PR:N/UI:R/S:U/C:N/I:N/A:H;5.5 MEDIUM;NVD (crawl);Divide By Zero error in tiffcrop in libtiff 4.3.0 allows attackers to cause a denial-of-service via a crafted tiff file. For users that compile libtiff from sources, the fix is available with commit f8d0f9aa.;NO
CVE-2022-0924;CVSS:3.1/AV:L/AC:L/PR:N/UI:R/S:U/C:N/I:N/A:H;5.5 MEDIUM;NVD (crawl);Out-of-bounds Read error in tiffcp in libtiff 4.3.0 allows attackers to cause a denial-of-service via a crafted tiff file. For users that compile libtiff from sources, the fix is available with commit 408976c4.;NO
CVE-2022-1056;CVSS:3.1/AV:L/AC:L/PR:N/UI:R/S:U/C:N/I:N/A:H;5.5 MEDIUM;NVD (crawl);Out-of-bounds Read error in tiffcrop in libtiff 4.3.0 allows attackers to cause a denial-of-service via a crafted tiff file. For users that compile libtiff from sources, the fix is available with commit 46dc8fcd.;NO
CVE-2021-33061;CVSS:3.1/AV:L/AC:L/PR:L/UI:N/S:U/C:N/I:N/A:H;5.5 MEDIUM;NVD (crawl);Insufficient control flow management for the Intel(R) 82599 Ethernet Controllers and Adapters may allow an authenticated user to potentially enable denial of service via local access.;NO
CVE-2022-1184;CVSS:3.1/AV:L/AC:L/PR:L/UI:N/S:U/C:N/I:N/A:H;5.5 MEDIUM;NVD (crawl);A use-after-free flaw was found in fs/ext4/namei.c:dx_insert_block() in the Linux kernel’s filesystem sub-component. This flaw allows a local attacker with a user privilege to cause a denial of service.;NO
CVE-2022-1516;CVSS:3.1/AV:L/AC:L/PR:L/UI:N/S:U/C:N/I:N/A:H;5.5 MEDIUM;NVD (crawl);A NULL pointer dereference flaw was found in the Linux kernel’s X.25 set of standardized network protocols functionality in the way a user terminates their session using a simulated Ethernet card and continued usage of this connection. This flaw allows a local user to crash the system.;NO
CVE-2022-1975;CVSS:3.1/AV:L/AC:L/PR:L/UI:N/S:U/C:N/I:N/A:H;5.5 MEDIUM;NVD (crawl);There is a sleep-in-atomic bug in /net/nfc/netlink.c that allows an attacker to crash the Linux kernel by simulating a nfc device from user-space.;NO
CVE-2022-21123;CVSS:3.1/AV:L/AC:L/PR:L/UI:N/S:U/C:H/I:N/A:N;5.5 MEDIUM;NVD (crawl);Incomplete cleanup of multi-core shared buffers for some Intel(R) Processors may allow an authenticated user to potentially enable information disclosure via local access.;NO
CVE-2022-21125;CVSS:3.1/AV:L/AC:L/PR:L/UI:N/S:U/C:H/I:N/A:N;5.5 MEDIUM;NVD (crawl);Incomplete cleanup of microarchitectural fill buffers on some Intel(R) Processors may allow an authenticated user to potentially enable information disclosure via local access.;NO
CVE-2022-21127;CVSS:3.1/AV:L/AC:L/PR:L/UI:N/S:U/C:H/I:N/A:N;5.5 MEDIUM;NVD (crawl);Incomplete cleanup in specific special register read operations for some Intel(R) Processors may allow an authenticated user to potentially enable information disclosure via local access.;NO
CVE-2022-21166;CVSS:3.1/AV:L/AC:L/PR:L/UI:N/S:U/C:H/I:N/A:N;5.5 MEDIUM;NVD (crawl);Incomplete cleanup in specific special register write operations for some Intel(R) Processors may allow an authenticated user to potentially enable information disclosure via local access.;NO
CVE-2022-21180;CVSS:3.1/AV:L/AC:L/PR:L/UI:N/S:U/C:N/I:N/A:H;5.5 MEDIUM;NVD (crawl);Improper input validation for some Intel(R) Processors may allow an authenticated user to potentially cause a denial of service via local access.;NO
CVE-2017-17087;CVSS:3.1/AV:L/AC:L/PR:L/UI:N/S:U/C:H/I:N/A:N;5.5 MEDIUM;NVD (crawl);fileio.c in Vim prior to 8.0.1263 sets the group ownership of a .swp file to the editor's primary group (which may be different from the group ownership of the original file), which allows local users to obtain sensitive information by leveraging an applicable group membership, as demonstrated by /etc/shadow owned by root:shadow mode 0640, but /etc/.shadow.swp owned by root:users mode 0640, a different vulnerability than CVE-2017-1000382.;NO
CVE-2021-3875;CVSS:3.1/AV:L/AC:L/PR:N/UI:R/S:U/C:N/I:N/A:H;5.5 MEDIUM;NVD (crawl);vim is vulnerable to Heap-based Buffer Overflow;NO
CVE-2021-4193;CVSS:3.1/AV:L/AC:L/PR:N/UI:R/S:U/C:H/I:N/A:N;5.5 MEDIUM;NVD (crawl);vim is vulnerable to Out-of-bounds Read;NO
CVE-2022-0319;CVSS:3.1/AV:L/AC:L/PR:N/UI:R/S:U/C:H/I:N/A:N;5.5 MEDIUM;NVD (crawl);Out-of-bounds Read in vim/vim prior to 8.2.;NO
CVE-2022-0696;CVSS:3.1/AV:L/AC:L/PR:N/UI:R/S:U/C:N/I:N/A:H;5.5 MEDIUM;NVD (crawl);NULL Pointer Dereference in GitHub repository vim/vim prior to 8.2.4428.;NO
CVE-2022-1420;CVSS:3.1/AV:L/AC:L/PR:N/UI:R/S:U/C:N/I:N/A:H;5.5 MEDIUM;NVD (crawl);Use of Out-of-range Pointer Offset in GitHub repository vim/vim prior to 8.2.4774.;NO
CVE-2022-1771;CVSS:3.1/AV:L/AC:L/PR:N/UI:R/S:U/C:N/I:N/A:H;5.5 MEDIUM;NVD (crawl);Uncontrolled Recursion in GitHub repository vim/vim prior to 8.2.4975.;NO
CVE-2022-31783;CVSS:3.1/AV:L/AC:L/PR:N/UI:R/S:U/C:N/I:N/A:H;5.5 MEDIUM;NVD (crawl);Liblouis 3.21.0 has an out-of-bounds write in compileRule in compileTranslationTable.c, as demonstrated by lou_trace.;NO
CVE-2022-21123;CVSS:3.1/AV:L/AC:L/PR:L/UI:N/S:U/C:H/I:N/A:N;5.5 MEDIUM;NVD (crawl);Incomplete cleanup of multi-core shared buffers for some Intel(R) Processors may allow an authenticated user to potentially enable information disclosure via local access.;NO
CVE-2022-21125;CVSS:3.1/AV:L/AC:L/PR:L/UI:N/S:U/C:H/I:N/A:N;5.5 MEDIUM;NVD (crawl);Incomplete cleanup of microarchitectural fill buffers on some Intel(R) Processors may allow an authenticated user to potentially enable information disclosure via local access.;NO
CVE-2022-21166;CVSS:3.1/AV:L/AC:L/PR:L/UI:N/S:U/C:H/I:N/A:N;5.5 MEDIUM;NVD (crawl);Incomplete cleanup in specific special register write operations for some Intel(R) Processors may allow an authenticated user to potentially enable information disclosure via local access.;NO
CVE-2022-33068;CVSS:3.1/AV:L/AC:L/PR:N/UI:R/S:U/C:N/I:N/A:H;5.5 MEDIUM;NVD (crawl);An integer overflow in the component hb-ot-shape-fallback.cc of Harfbuzz v4.3.0 allows attackers to cause a Denial of Service (DoS) via unspecified vectors.;NO
CVE-2022-2318;CVSS:3.1/AV:L/AC:L/PR:L/UI:N/S:U/C:N/I:N/A:H;5.5 MEDIUM;NVD (crawl);There are use-after-free vulnerabilities caused by timer handler in net/rose/rose_timer.c of linux that allow attackers to crash linux kernel without any privileges.;NO
CVE-2022-21233;CVSS:3.1/AV:L/AC:L/PR:L/UI:N/S:U/C:H/I:N/A:N;5.5 MEDIUM;NVD (crawl);Improper isolation of shared resources in some Intel(R) Processors may allow a privileged user to potentially enable information disclosure via local access.;NO
CVE-2022-2208;CVSS:3.1/AV:L/AC:L/PR:N/UI:R/S:U/C:N/I:N/A:H;5.5 MEDIUM;NVD (crawl);NULL Pointer Dereference in GitHub repository vim/vim prior to 8.2.5163.;NO
CVE-2022-2231;CVSS:3.1/AV:L/AC:L/PR:N/UI:R/S:U/C:N/I:N/A:H;5.5 MEDIUM;NVD (crawl);NULL Pointer Dereference in GitHub repository vim/vim prior to 8.2.;NO
CVE-2022-2598;CVSS:3.1/AV:L/AC:L/PR:N/UI:R/S:U/C:N/I:N/A:H;5.5 MEDIUM;NVD (crawl);Out-of-bounds Write to API in GitHub repository vim/vim prior to 9.0.0100.;NO
CVE-2022-2874;CVSS:3.1/AV:L/AC:L/PR:N/UI:R/S:U/C:N/I:N/A:H;5.5 MEDIUM;NVD (crawl);NULL Pointer Dereference in GitHub repository vim/vim prior to 9.0.0224.;NO
CVE-2022-2923;CVSS:3.1/AV:L/AC:L/PR:N/UI:R/S:U/C:N/I:N/A:H;5.5 MEDIUM;NVD (crawl);NULL Pointer Dereference in GitHub repository vim/vim prior to 9.0.0240.;NO
CVE-2021-36978;CVSS:3.1/AV:L/AC:L/PR:N/UI:R/S:U/C:N/I:N/A:H;5.5 MEDIUM;NVD (crawl);QPDF 9.x through 9.1.1 and 10.x through 10.0.4 has a heap-based buffer overflow in Pl_ASCII85Decoder::write (called from Pl_AES_PDF::flush and Pl_AES_PDF::finish) when a certain downstream write fails.;NO
CVE-2022-36314;CVSS:3.1/AV:L/AC:L/PR:N/UI:R/S:U/C:N/I:H/A:N;5.5 MEDIUM;NVD (crawl);When opening a Windows shortcut from the local filesystem, an attacker could supply a remote path that would lead to unexpected network requests from the operating system.<br>This bug only affects Firefox for Windows. Other operating systems are unaffected.*. This vulnerability affects Firefox ESR < 102.1, Firefox < 103, and Thunderbird < 102.1.;NO
CVE-2016-3695;CVSS:3.0/AV:L/AC:L/PR:L/UI:N/S:U/C:N/I:N/A:H;5.5 MEDIUM;NVD (crawl);The einj_error_inject function in drivers/acpi/apei/einj.c in the Linux kernel allows local users to simulate hardware errors and consequently cause a denial of service by leveraging failure to disable APEI error injection through EINJ when securelevel is set.;NO
CVE-2020-27784;CVSS:3.1/AV:L/AC:L/PR:L/UI:N/S:U/C:N/I:N/A:H;5.5 MEDIUM;NVD (crawl);A vulnerability was found in the Linux kernel, where accessing a deallocated instance in printer_ioctl() printer_ioctl() tries to access of a printer_dev instance. However, use-after-free arises because it had been freed by gprinter_free().;NO
CVE-2021-4155;CVSS:3.1/AV:L/AC:L/PR:L/UI:N/S:U/C:H/I:N/A:N;5.5 MEDIUM;NVD (crawl);A data leak flaw was found in the way XFS_IOC_ALLOCSP IOCTL in the XFS filesystem allowed for size increase of files with unaligned size. A local attacker could use this flaw to leak data on the XFS filesystem otherwise not accessible to them.;NO
CVE-2022-26373;CVSS:3.1/AV:L/AC:L/PR:L/UI:N/S:U/C:H/I:N/A:N;5.5 MEDIUM;NVD (crawl);Non-transparent sharing of return predictor targets between contexts in some Intel(R) Processors may allow an authorized user to potentially enable information disclosure via local access.;NO
CVE-2022-2905;CVSS:3.1/AV:L/AC:L/PR:L/UI:N/S:U/C:H/I:N/A:N;5.5 MEDIUM;NVD (crawl);An out-of-bounds memory read flaw was found in the Linux kernel's BPF subsystem in how a user calls the bpf_tail_call function with a key larger than the max_entries of the map. This flaw allows a local user to gain unauthorized access to data.;NO
CVE-2022-36879;CVSS:3.1/AV:L/AC:L/PR:L/UI:N/S:U/C:N/I:N/A:H;5.5 MEDIUM;NVD (crawl);An issue was discovered in the Linux kernel through 5.18.14. xfrm_expand_policies in net/xfrm/xfrm_policy.c can cause a refcount to be dropped twice.;NO
CVE-2021-22570;CVSS:3.1/AV:L/AC:L/PR:L/UI:N/S:U/C:N/I:N/A:H;5.5 MEDIUM;NVD (crawl);Nullptr dereference when a null char is present in a proto symbol. The symbol is parsed incorrectly, leading to an unchecked call into the proto file's name during generation of the resulting error message. Since the symbol is incorrectly parsed, the file is nullptr. We recommend upgrading to version 3.15.0 or greater.;NO
CVE-2021-4002;CVSS:3.1/AV:L/AC:L/PR:L/UI:N/S:U/C:L/I:L/A:N;4.4 MEDIUM;NVD (crawl);A memory leak flaw in the Linux kernel's hugetlbfs memory usage was found in the way the user maps some regions of memory twice using shmget() which are aligned to PUD alignment with the fault of some of the memory pages. A local user could use this flaw to get unauthorized access to some data.;NO
CVE-2021-45486;CVSS:3.1/AV:A/AC:L/PR:L/UI:N/S:U/C:L/I:N/A:N;3.5 LOW;NVD (crawl);In the IPv4 implementation in the Linux kernel before 5.12.4, net/ipv4/route.c has an information leak because the hash table is very small.;NO
CVE-2020-16121;CVSS:3.1/AV:L/AC:L/PR:L/UI:N/S:U/C:L/I:N/A:N;3.3 LOW;NVD (crawl);PackageKit provided detailed error messages to unprivileged callers that exposed information about file presence and mimetype of files that the user would be unable to determine on its own.;NO
CVE-2020-29623;CVSS:3.1/AV:L/AC:L/PR:L/UI:N/S:U/C:N/I:L/A:N;3.3 LOW;NVD (crawl);"""Clear History and Website Data"" did not clear the history. The issue was addressed with improved data deletion. This issue is fixed in macOS Big Sur 11.1, Security Update 2020-001 Catalina, Security Update 2020-007 Mojave, iOS 14.3 and iPadOS 14.3, tvOS 14.3. A user may be unable to fully delete browsing history.";NO
CVE-2022-24448;CVSS:3.1/AV:L/AC:L/PR:L/UI:N/S:U/C:L/I:N/A:N;3.3 LOW;NVD (crawl);An issue was discovered in fs/nfs/dir.c in the Linux kernel before 5.16.5. If an application sets the O_DIRECTORY flag, and tries to open a regular file, nfs_atomic_open() performs a regular lookup. If a regular file is found, ENOTDIR should occur, but the server instead returns uninitialized data in the file descriptor.;NO
CVE-2021-26342;CVSS:3.1/AV:L/AC:L/PR:L/UI:N/S:U/C:L/I:N/A:N;3.3 LOW;NVD (crawl);In SEV guest VMs, the CPU may fail to flush the Translation Lookaside Buffer (TLB) following a particular sequence of operations that includes creation of a new virtual machine control block (VMCB). The failure to flush the TLB may cause the microcode to use stale TLB translations which may allow for disclosure of SEV guest memory contents. Users of SEV-ES/SEV-SNP guest VMs are not impacted by this vulnerability.;NO
CVE-2022-33981;CVSS:3.1/AV:L/AC:L/PR:L/UI:N/S:U/C:N/I:N/A:L;3.3 LOW;NVD (crawl);drivers/block/floppy.c in the Linux kernel before 5.17.6 is vulnerable to a denial of service, because of a concurrency use-after-free flaw after deallocating raw_cmd in the raw_cmd_ioctl function.;NO
CVE-2022-33981;CVSS:3.1/AV:L/AC:L/PR:L/UI:N/S:U/C:N/I:N/A:L;3.3 LOW;NVD (crawl);drivers/block/floppy.c in the Linux kernel before 5.17.6 is vulnerable to a denial of service, because of a concurrency use-after-free flaw after deallocating raw_cmd in the raw_cmd_ioctl function.;NO
CVE-2024-0217;CVSS:3.1/AV:L/AC:L/PR:L/UI:N/S:U/C:N/I:N/A:L;3.3 LOW;NVD (crawl);A use-after-free flaw was found in PackageKitd. In some conditions, the order of cleanup mechanics for a transaction could be impacted. As a result, some memory access could occur on memory regions that were previously freed. Once freed, a memory region can be reused for other allocations and any previously stored data in this memory region is considered lost.;NO
